{
  "schema_version": 2,
  "project_id": "platberlitz-sd-proxy",
  "repository": {
    "id": 1132779410,
    "owner": "platberlitz",
    "name": "sd-proxy",
    "url": "https://github.com/platberlitz/sd-proxy",
    "description": "Multi-backend image generation proxy with OpenAI-compatible API and comprehensive web dashboard",
    "default_branch": "main",
    "head_sha": "d7d17addf01db615a65bc0834cf5a223fd792583",
    "head_committed_at": "2026-05-05T07:00:08.000Z",
    "archived": false,
    "created_at": "2026-01-12T12:47:49.000Z",
    "size_kb": 364
  },
  "source_health": "healthy",
  "activity": {
    "latest_source_activity_at": "2026-05-05T07:00:08.000Z",
    "source_weeks": [
      {
        "week_start": "2026-05-04",
        "latest_at": "2026-05-05T07:00:08.000Z",
        "precision": "exact"
      }
    ],
    "provisional_weeks": null,
    "latest_release_at": null,
    "evidence_status": "complete",
    "baseline_completed_at": "2026-07-25T05:01:47.527Z",
    "baseline_attempts": 0
  },
  "community": {
    "stargazers_count": 4,
    "forks_count": 1,
    "subscribers_count": 1,
    "aggregate": 6
  },
  "license": { "status": "missing", "spdx_id": null, "source_path": null },
  "refreshed_at": "2026-07-26T04:48:30.967Z",
  "stale_since": null,
  "contributors": {
    "accounts": [{ "login": "web-flow", "type": "User" }],
    "refreshed_at": "2026-07-26T04:48:30.967Z",
    "stale_since": null
  }
}
