{
  "schema_version": 2,
  "project_id": "chesswoodspixel-sillytavern-lorebookstickysort",
  "repository": {
    "id": 1095739220,
    "owner": "chesswoodspixel",
    "name": "SillyTavern-LorebookStickySort",
    "url": "https://github.com/chesswoodspixel/SillyTavern-LorebookStickySort",
    "description": "SillyTavern extension that remembers your preferred sort order for each lorebook.",
    "default_branch": "main",
    "head_sha": "5deba7bacdc36deef4fe4dcb5941ee122ab75b6c",
    "head_committed_at": "2025-11-22T05:36:57.000Z",
    "archived": false,
    "created_at": "2025-11-13T13:05:36.000Z",
    "size_kb": 128
  },
  "source_health": "healthy",
  "activity": {
    "latest_source_activity_at": null,
    "source_weeks": [],
    "provisional_weeks": null,
    "latest_release_at": null,
    "evidence_status": "complete",
    "baseline_completed_at": "2026-07-25T02:49:36.921Z",
    "baseline_attempts": 0
  },
  "community": {
    "stargazers_count": 2,
    "forks_count": 0,
    "subscribers_count": 0,
    "aggregate": 2
  },
  "license": {
    "status": "osi-approved",
    "spdx_id": "AGPL-3.0",
    "source_path": "LICENSE"
  },
  "refreshed_at": "2026-07-25T21:20:33.057Z",
  "stale_since": null,
  "contributors": {
    "accounts": [{ "login": "chesswoodspixel", "type": "User" }],
    "refreshed_at": "2026-07-25T21:20:33.057Z",
    "stale_since": null
  }
}
