{
  "schema_version": 2,
  "project_id": "morgoookru-st-chat-finder",
  "repository": {
    "id": 1167832752,
    "owner": "MorgoookRU",
    "name": "st-chat-finder",
    "url": "https://github.com/MorgoookRU/st-chat-finder",
    "description": "Simple SillyTavern extencion for find/replace text in your chats",
    "default_branch": "main",
    "head_sha": "387e08efd3c9d47c2c0baeca4553fec96a402976",
    "head_committed_at": "2026-02-26T18:26:29.000Z",
    "archived": false,
    "created_at": "2026-02-26T18:25:17.000Z",
    "size_kb": 4
  },
  "source_health": "healthy",
  "activity": {
    "latest_source_activity_at": null,
    "source_weeks": [],
    "provisional_weeks": null,
    "latest_release_at": null,
    "evidence_status": "complete",
    "baseline_completed_at": "2026-07-25T03:20:38.748Z",
    "baseline_attempts": 0
  },
  "community": {
    "stargazers_count": 1,
    "forks_count": 0,
    "subscribers_count": 0,
    "aggregate": 1
  },
  "license": { "status": "missing", "spdx_id": null, "source_path": null },
  "refreshed_at": "2026-07-26T04:48:30.967Z",
  "stale_since": null,
  "contributors": {
    "accounts": [{ "login": "MorgoookRU", "type": "User" }],
    "refreshed_at": "2026-07-26T04:48:30.967Z",
    "stale_since": null
  }
}
