{
  "schema_version": 2,
  "project_id": "thexyzzyone-stfastuserswitching",
  "repository": {
    "id": 1310042863,
    "owner": "thexyzzyone",
    "name": "STFastUserSwitching",
    "url": "https://github.com/thexyzzyone/STFastUserSwitching",
    "description": "SillyTavern extension for multi-user installs. Adds a top-bar button showing your current avatar—click it to pop up a picker of every other enabled login user and switch instantly. Supports password-protected accounts, avatar or list display modes, and auto-hides when multi-user accounts are disabled or discreet login mode is active.",
    "default_branch": "main",
    "head_sha": "51fac79842f46a159b6615e86a9c956fd861b9ca",
    "head_committed_at": "2026-07-23T14:37:06.000Z",
    "archived": false,
    "fork": false,
    "created_at": "2026-07-23T14:39:04.000Z",
    "size_kb": 179
  },
  "source_health": "healthy",
  "activity": {
    "latest_source_activity_at": "2026-07-23T14:37:06.000Z",
    "source_weeks": [
      {
        "week_start": "2026-07-20",
        "latest_at": "2026-07-23T14:37:06.000Z",
        "precision": "exact"
      }
    ],
    "provisional_weeks": null,
    "latest_release_at": null,
    "evidence_status": "complete",
    "baseline_completed_at": "2026-07-25T06:13:32.026Z",
    "baseline_attempts": 0
  },
  "community": {
    "stargazers_count": 1,
    "forks_count": 0,
    "subscribers_count": 0,
    "aggregate": 1
  },
  "license": {
    "status": "osi-approved",
    "spdx_id": "MIT",
    "source_path": "LICENSE.md"
  },
  "refreshed_at": "2026-07-27T06:46:55.988Z",
  "stale_since": null,
  "contributors": {
    "accounts": [{ "login": "thexyzzyone", "type": "User" }],
    "method": "repository-contributors",
    "baseline_completed_at": null,
    "scan": null,
    "refreshed_at": "2026-07-27T06:46:55.988Z",
    "stale_since": null
  }
}
