{
  "schema_version": 2,
  "project_id": "sillytavern-extension-weather",
  "repository": {
    "id": 819108745,
    "owner": "SillyTavern",
    "name": "Extension-Weather",
    "url": "https://github.com/SillyTavern/Extension-Weather",
    "description": "Adds a slash command that returns the current weather for a given location.",
    "default_branch": "main",
    "head_sha": "c169a3cacaefd032d2857417564e0330b516a1b3",
    "head_committed_at": "2026-03-15T23:10:27.000Z",
    "archived": false,
    "fork": false,
    "created_at": "2024-06-23T19:58:18.000Z",
    "size_kb": 43
  },
  "source_health": "healthy",
  "activity": {
    "latest_source_activity_at": null,
    "source_weeks": [],
    "provisional_weeks": null,
    "latest_release_at": null,
    "evidence_status": "complete",
    "baseline_completed_at": "2026-07-27T10:52:18.639Z",
    "baseline_attempts": 0,
    "evidence_head_sha": "c169a3cacaefd032d2857417564e0330b516a1b3"
  },
  "community": {
    "stargazers_count": 5,
    "forks_count": 5,
    "subscribers_count": 1,
    "aggregate": 11
  },
  "license": {
    "status": "osi-approved",
    "spdx_id": "AGPL-3.0",
    "source_path": "LICENSE"
  },
  "refreshed_at": "2026-07-27T10:52:18.639Z",
  "stale_since": null,
  "contributors": {
    "accounts": [
      { "login": "Cohee1207", "type": "User" },
      { "login": "Copilot", "type": "Bot" }
    ],
    "method": "repository-contributors",
    "baseline_completed_at": null,
    "scan": null,
    "refreshed_at": "2026-07-27T10:52:18.639Z",
    "stale_since": null
  },
  "activity_scan": null
}
