{
  "schema_version": 2,
  "project_id": "hornysilicon-innervoice",
  "repository": {
    "id": 1297591852,
    "owner": "hornysilicon",
    "name": "innerVoice",
    "url": "https://github.com/hornysilicon/innerVoice",
    "description": null,
    "default_branch": "main",
    "head_sha": "c2abfee703d4cac0c072cc622187f455b49611cc",
    "head_committed_at": "2026-07-11T16:15:17.000Z",
    "archived": false,
    "fork": false,
    "created_at": "2026-07-11T16:10:52.000Z",
    "size_kb": 10
  },
  "source_health": "healthy",
  "activity": {
    "latest_source_activity_at": "2026-07-11T16:10:30.000Z",
    "source_weeks": [
      {
        "week_start": "2026-07-06",
        "latest_at": "2026-07-11T16:10:30.000Z",
        "precision": "exact"
      }
    ],
    "provisional_weeks": null,
    "latest_release_at": null,
    "evidence_status": "complete",
    "baseline_completed_at": "2026-07-27T21:11:50.931Z",
    "baseline_attempts": 0,
    "evidence_head_sha": "c2abfee703d4cac0c072cc622187f455b49611cc"
  },
  "community": {
    "stargazers_count": 0,
    "forks_count": 0,
    "subscribers_count": 0,
    "aggregate": 0
  },
  "license": { "status": "missing", "spdx_id": null, "source_path": null },
  "refreshed_at": "2026-07-27T21:11:50.931Z",
  "stale_since": null,
  "contributors": {
    "accounts": [{ "login": "hornysilicon", "type": "User" }],
    "method": "repository-contributors",
    "baseline_completed_at": null,
    "scan": null,
    "refreshed_at": "2026-07-27T21:11:50.931Z",
    "stale_since": null
  },
  "activity_scan": null
}
